{
  "artifact_validation": {
    "onnx": {
      "resnet50_onnx": {
        "input": {
          "name": "images",
          "shape": [
            "batch",
            3,
            224,
            224
          ]
        },
        "ir_version": 8,
        "onnx_checker": "passed",
        "onnxruntime_inference": "passed",
        "opset": 17,
        "output": {
          "name": "logits",
          "shape": [
            "batch",
            1000
          ]
        }
      },
      "yolo11n_onnx": {
        "input": {
          "name": "images",
          "shape": [
            "batch",
            3,
            640,
            640
          ]
        },
        "ir_version": 8,
        "onnx_checker": "passed",
        "onnxruntime_inference": "passed",
        "opset": 17,
        "output": {
          "name": "output0",
          "shape": [
            "batch",
            84,
            8400
          ]
        }
      }
    },
    "tensorrt": {
      "engine_deserialization": "passed",
      "engine_sha256": "73918c7d2379f130f6b712e392c8f604ef11b3ada49e18b26e9c5e131c6d5183",
      "input": {
        "dtype": "FP32",
        "name": "images",
        "shape": [
          4,
          3,
          224,
          224
        ]
      },
      "onnx_source_sha256": "7a91a4d645e5eca6608573c7a0bb0d82e0f8c65db48e891380efc2c470f8f016",
      "output": {
        "dtype": "FP32",
        "name": "logits",
        "shape": [
          4,
          1000
        ]
      },
      "parity": {
        "cosine_similarity": 0.9996493709698281,
        "max_abs_error": 0.16452789306640625,
        "mean_abs_error": 0.01703711971640587,
        "status": "passed",
        "tolerances": {
          "max_abs_error": 0.5,
          "mean_abs_error": 0.05,
          "minimum_cosine_similarity": 0.999,
          "minimum_top1_agreement": 1.0
        },
        "top1_agreement": 1.0
      }
    }
  },
  "build": {
    "exporter_image": "docker.io/ultralytics/ultralytics:8.3.0-cpu@sha256:e666f09be0c147448c83dae39308f552e77ac526096bca8755e52af611991619",
    "exporter_packages": {
      "PyYAML": "6.0.2",
      "numpy": "1.26.4",
      "onnx": "1.16.2",
      "onnxconverter-common": "1.16.0",
      "onnxruntime": "1.19.2",
      "torch": "2.4.1+cpu",
      "torchvision": "0.19.1+cpu",
      "ultralytics": "8.3.0"
    },
    "gpu": {
      "compute_capability": "8.9",
      "driver_version": "610.88",
      "name": "NVIDIA GeForce RTX 4080 Laptop GPU"
    },
    "onnx_opset": 17,
    "simplify": false,
    "tensorrt_builder_image": "nvcr.io/nvidia/tensorrt:26.07-py3@sha256:715352ed6840166888d79b135dd2a8d3f23ffe3169b8cacb6ca4df270388a8df",
    "tensorrt_environment": {
      "cuda_version": "13.3.1.008",
      "tensorrt_version": "11.1.0.106"
    },
    "tensorrt_input": {
      "fp16_initializers": 108,
      "input_dtype": "FP32",
      "output_dtype": "FP32",
      "path": ".cache/model-preparation/resnet50-fp16.onnx",
      "sha256": "69d087b13b1b15cad45c9dea28735da3df51d0d9ac4f5cc05dfc0a12b35bbb33",
      "source_path": "models/resnet50_onnx/1/model.onnx",
      "source_sha256": "7a91a4d645e5eca6608573c7a0bb0d82e0f8c65db48e891380efc2c470f8f016"
    }
  },
  "generated_at_utc": "2026-07-31T18:26:04.634493Z",
  "models": {
    "resnet50_onnx": {
      "artifact": {
        "path": "models/resnet50_onnx/1/model.onnx",
        "sha256": "7a91a4d645e5eca6608573c7a0bb0d82e0f8c65db48e891380efc2c470f8f016",
        "size_bytes": 102146384
      },
      "input": {
        "dtype": "FP32",
        "name": "images",
        "shape": [
          -1,
          3,
          224,
          224
        ]
      },
      "labels": {
        "count": 1000,
        "filename": "imagenet1k.txt",
        "generated_sha256": "e697a491aa735cc6c2aaf982f8e86e8fc7b0a1ea7750a2cc6a2bdfc1e109012f",
        "source_sha256": "1f386e0d1cb6e28b9c2dac651c3dea6801e98ad1b41a14ce6bb1a093d72069f5",
        "source_url": "https://raw.githubusercontent.com/pytorch/hub/master/imagenet_classes.txt"
      },
      "logical_model_id": "resnet50",
      "max_batch_size": 8,
      "onnx": {
        "input": {
          "name": "images",
          "shape": [
            "batch",
            3,
            224,
            224
          ]
        },
        "ir_version": 8,
        "onnx_checker": "passed",
        "onnxruntime_inference": "passed",
        "opset": 17,
        "output": {
          "name": "logits",
          "shape": [
            "batch",
            1000
          ]
        }
      },
      "output": {
        "dtype": "FP32",
        "name": "logits",
        "shape": [
          -1,
          1000
        ]
      },
      "parity_tolerances": {
        "max_abs_error": 0.5,
        "mean_abs_error": 0.05,
        "minimum_cosine_similarity": 0.999,
        "minimum_top1_agreement": 1.0
      },
      "precision": "FP32",
      "smoke_batches": [
        1,
        4,
        8
      ],
      "source": {
        "code_license": "BSD-3-Clause",
        "filename": "resnet50-11ad3fa6.pth",
        "framework": "torchvision",
        "hash_status": "resolved",
        "identifier": "ResNet50_Weights.IMAGENET1K_V2",
        "sha256": "11ad3fa62ca79e40addfd354a8ec4b7c75143b3038b8d2a807fbc68deab379ca",
        "url": "https://download.pytorch.org/models/resnet50-11ad3fa6.pth",
        "weights_terms": "ImageNet-derived; upstream dataset and weight terms require independent review"
      }
    },
    "resnet50_tensorrt": {
      "artifact": {
        "path": "models/resnet50_tensorrt/1/model_cc89.plan",
        "sha256": "73918c7d2379f130f6b712e392c8f604ef11b3ada49e18b26e9c5e131c6d5183",
        "size_bytes": 51657828
      },
      "compute_capability": "8.9",
      "compute_precision": "FP16",
      "input": {
        "dtype": "FP32",
        "name": "images",
        "shape": [
          -1,
          3,
          224,
          224
        ]
      },
      "io_precision": "FP32",
      "labels": {
        "count": 1000,
        "filename": "imagenet1k.txt",
        "generated_sha256": "e697a491aa735cc6c2aaf982f8e86e8fc7b0a1ea7750a2cc6a2bdfc1e109012f",
        "source_sha256": "1f386e0d1cb6e28b9c2dac651c3dea6801e98ad1b41a14ce6bb1a093d72069f5",
        "source_url": "https://raw.githubusercontent.com/pytorch/hub/master/imagenet_classes.txt"
      },
      "logical_model_id": "resnet50",
      "max_batch_size": 8,
      "output": {
        "dtype": "FP32",
        "name": "logits",
        "shape": [
          -1,
          1000
        ]
      },
      "parity_tolerances": {
        "max_abs_error": 0.5,
        "mean_abs_error": 0.05,
        "minimum_cosine_similarity": 0.999,
        "minimum_top1_agreement": 1.0
      },
      "precision": "FP16",
      "profile": {
        "max": [
          8,
          3,
          224,
          224
        ],
        "min": [
          1,
          3,
          224,
          224
        ],
        "opt": [
          4,
          3,
          224,
          224
        ]
      },
      "smoke_batches": [
        1,
        4,
        8
      ],
      "source": {
        "code_license": "BSD-3-Clause",
        "filename": "resnet50-11ad3fa6.pth",
        "framework": "torchvision",
        "hash_status": "resolved",
        "identifier": "ResNet50_Weights.IMAGENET1K_V2",
        "sha256": "11ad3fa62ca79e40addfd354a8ec4b7c75143b3038b8d2a807fbc68deab379ca",
        "url": "https://download.pytorch.org/models/resnet50-11ad3fa6.pth",
        "weights_terms": "ImageNet-derived; upstream dataset and weight terms require independent review"
      }
    },
    "yolo11n_onnx": {
      "artifact": {
        "path": "models/yolo11n_onnx/1/model.onnx",
        "sha256": "c1ef3ec4e3eaff27304c193e4fcd296ae14dc12a171c91eeef87ce670e91efb5",
        "size_bytes": 10584348
      },
      "input": {
        "dtype": "FP32",
        "name": "images",
        "shape": [
          -1,
          3,
          640,
          640
        ]
      },
      "labels": {
        "count": 80,
        "extraction": "names",
        "filename": "coco80.txt",
        "generated_sha256": "bd17f1ee35d5f3c862a4894605855abbb9dda4b0621fdb0ac4c2c8c7bb7e730a",
        "source_sha256": "bd6f98a2e18775c39a4d5214080c87fcb163d367c18a2fcf2609371bab00c0b8",
        "source_url": "https://raw.githubusercontent.com/ultralytics/ultralytics/v8.3.0/ultralytics/cfg/datasets/coco.yaml"
      },
      "logical_model_id": "yolo11n",
      "max_batch_size": 2,
      "onnx": {
        "input": {
          "name": "images",
          "shape": [
            "batch",
            3,
            640,
            640
          ]
        },
        "ir_version": 8,
        "onnx_checker": "passed",
        "onnxruntime_inference": "passed",
        "opset": 17,
        "output": {
          "name": "output0",
          "shape": [
            "batch",
            84,
            8400
          ]
        }
      },
      "output": {
        "dtype": "FP32",
        "name": "output0",
        "shape": [
          -1,
          84,
          8400
        ]
      },
      "precision": "FP32",
      "smoke_batches": [
        1,
        2
      ],
      "source": {
        "code_license": "AGPL-3.0",
        "filename": "yolo11n.pt",
        "framework": "ultralytics",
        "hash_status": "resolved",
        "identifier": "yolo11n.pt",
        "sha256": "0ebbc80d4a7680d14987a577cd21342b65ecfd94632bd9a8da63ae6417644ee1",
        "url": "https://github.com/ultralytics/assets/releases/download/v8.3.0/yolo11n.pt",
        "weights_license": "AGPL-3.0"
      }
    }
  },
  "requirements_lock": "scripts/model_preparation/requirements.lock",
  "requirements_sha256": "d5d40dbfa1e905f6c5acf92a797ee3872053bcb28c142806190d499f9bb30955",
  "schema_version": 1,
  "spec_path": "models/model-spec.yaml",
  "spec_sha256": "648a2179dc67329694035b33ca0745946b781652a8e92398e7cc318b9a8f5344"
}
